{
  "manifest_version": "1.0",
  "plan_id": "gate-c1-qwen3-0.6b-mi355x-tp-search-v1",
  "candidate_id": "tp1_shape1_ep1_epshape1_ar1_fr1",
  "input_identity": {
    "topology": {
      "name": "domain8",
      "num_machines": 5,
      "gpus_per_machine": 8,
      "scale_up_GBps": 400.0,
      "scale_out_GBps": 50.0,
      "topology_id": "59d240e93a1350f9"
    },
    "hardware": {
      "device": "mi355x",
      "memory_margin_fraction": 0.2
    },
    "model": {
      "model_name": "Qwen3-0.6B",
      "total_experts": 0,
      "router_topk": 0,
      "is_moe": false,
      "hidden_size": 1024,
      "num_attention_heads": 16,
      "num_key_value_heads": 8,
      "num_layers": 28,
      "head_dim": 128,
      "kv_factor": null,
      "runtime_num_kv_heads": null,
      "runtime_head_dim": null
    },
    "workload": {
      "regime": "streaming",
      "num_requests": 32,
      "prefill_tokens": 5,
      "decode_tokens": 32,
      "qps": 4.0,
      "seed": 0,
      "num_seeds": 3,
      "workload_identity": null
    },
    "constraints": {
      "slo_tpot_ms": 50.0,
      "slo_attainment_floor": 0.0,
      "throughput_floor": {
        "mode": "absolute",
        "value": 0.0,
        "baseline_candidate_id": null
      },
      "memory_margin_fraction": 0.2,
      "availability_assumptions": null
    },
    "objective": {
      "minimize": "mean_tpot_ms",
      "direction": "minimize"
    }
  },
  "parallelism": {
    "attn_tp": 1,
    "attn_shape": [
      1
    ],
    "ffn_ep": 1,
    "ep_shape": [
      1
    ],
    "relative": null,
    "attn_replicas": 1,
    "ffn_replicas": 1
  },
  "placement": {
    "assignments": [
      {
        "logical_group": "DECODE_ATTN",
        "replica": 0,
        "parallel_rank": 0,
        "host": "mi355x-host-0",
        "physical_gpu": 1
      },
      {
        "logical_group": "DECODE_FFN",
        "replica": 0,
        "parallel_rank": 0,
        "host": "mi355x-host-0",
        "physical_gpu": 2
      },
      {
        "logical_group": "PREFILL",
        "replica": 0,
        "parallel_rank": 0,
        "host": "mi355x-host-0",
        "physical_gpu": 0
      }
    ],
    "topology_machine_to_host": {
      "0": "mi355x-host-0",
      "1": "mi355x-host-1",
      "2": "mi355x-host-2",
      "3": "mi355x-host-3",
      "4": "mi355x-host-4"
    }
  },
  "runtime": {
    "engine": "vllm",
    "engine_version": "0.27.1",
    "model_revision": "c1899de289a04d12100db370d81485cdf75e47ca",
    "precision": null,
    "quantization": null,
    "transport": null,
    "decode_ffn_scheduler": "orca"
  },
  "workload": {
    "regime": "streaming",
    "num_requests": 32,
    "prefill_tokens": 5,
    "decode_tokens": 32,
    "qps": 4.0,
    "seed": 0,
    "num_seeds": 3,
    "workload_identity": null
  },
  "constraints": {
    "slo_tpot_ms": 50.0,
    "slo_attainment_floor": 0.0,
    "throughput_floor": {
      "mode": "absolute",
      "value": 0.0,
      "baseline_candidate_id": null
    },
    "memory_margin_fraction": 0.2,
    "availability_assumptions": null
  },
  "profile_provenance": {
    "profile_files": [
      "data/profiling/compute/mi355x/Qwen3-0.6B/linear_op.csv",
      "data/profiling/compute/mi355x/Qwen3-0.6B/linear_op_kernel_only.csv",
      "data/profiling/compute/mi355x/Qwen3-0.6B/attention.csv",
      "data/profiling/compute/mi355x/Qwen3-0.6B/attention_kernel_only.csv",
      "data/profiling/compute/mi355x/Qwen3-0.6B/attention_combined.csv",
      "data/profiling/compute/mi355x/Qwen3-0.6B/attention_combined_kernel_only.csv"
    ],
    "device": "mi355x",
    "model": "Qwen3-0.6B",
    "operator_families_covered": [
      "linear_op",
      "attention"
    ],
    "collection_commit": "4883b3c",
    "profile_generation_version": null,
    "phase_filter_applied": false,
    "block_table_fix_applied": true,
    "grid_bounds": null,
    "known_limitations": [
      "qk_norm_allowlist_fix (Stage 2 Gate C.1): applied both at collection and evaluation (fixed docs/tasks/67) -- QK_NORM_MODEL_TYPE_ALLOWLIST includes 'qwen3'; use_qk_norm=True on both sides, verified.",
      "dense_model_moe_routing_guard (Stage 2 Gate C.1): installed at evaluation (docs/tasks/69) -- SklearnDisaggregationExecutionTimePredictor skips MoE expert-routing simulation for this dense model (is_moe=False); no expert routing state/traffic exists for this prediction.",
      "RoPE/RMSNorm/vllm_config_context/attention_block_table_fix adapters were applied only during real GPU profile collection (vLLM/torch-dependent); none has an evaluation-side counterpart, confirmed (docs/tasks/67/68) -- evaluation is CPU-only and never imports torch.",
      "Attention-family operators (attn_prefill/attn_decode/attn_kv_cache_save) are served by trained sklearn models (interpolation-capable), not exact-key lookup; linear_op operators (attn_pre_proj/attn_post_proj/attn_rope/input_layernorm/post_attention_layernorm/emb/mlp_up_proj/mlp_down_proj/mlp_act) are exact-key lookups -- TP-aware coverage confirmed zero missing keys for TP in {1,2,4} at Gate C's own real workload."
    ]
  },
  "provenance": {
    "timestamp_utc": "2026-08-30T10:37:51.181579+00:00",
    "planner_git_sha": "29b3aee",
    "simulator_git_sha": "e63fb4e181f4df2d361b3116328341cb9fc3d093",
    "topology_id": "59d240e93a1350f9",
    "seed": 0
  }
}